[{"game_id":"2026_04_PIT_CLE","season":2026,"week":4,"game_type":"REG","home_team_id":"CLE","away_team_id":"PIT","kickoff_utc":"2026-10-02T00:15:00Z","roof":"outdoors","neutral":false},{"game_id":"2026_04_IND_WAS","season":2026,"week":4,"game_type":"REG","home_team_id":"WAS","away_team_id":"IND","kickoff_utc":"2026-10-04T13:30:00Z","roof":"outdoors","neutral":true},{"game_id":"2026_04_ARI_NYG","season":2026,"week":4,"game_type":"REG","home_team_id":"NYG","away_team_id":"ARI","kickoff_utc":"2026-10-04T17:00:00Z","roof":"outdoors","neutral":false},{"game_id":"2026_04_DAL_HOU","season":2026,"week":4,"game_type":"REG","home_team_id":"HOU","away_team_id":"DAL","kickoff_utc":"2026-10-04T17:00:00Z","roof":"","neutral":false},{"game_id":"2026_04_GB_TB","season":2026,"week":4,"game_type":"REG","home_team_id":"TB","away_team_id":"GB","kickoff_utc":"2026-10-04T17:00:00Z","roof":"outdoors","neutral":false},{"game_id":"2026_04_JAX_CIN","season":2026,"week":4,"game_type":"REG","home_team_id":"CIN","away_team_id":"JAX","kickoff_utc":"2026-10-04T17:00:00Z","roof":"outdoors","neutral":false},{"game_id":"2026_04_LA_PHI","season":2026,"week":4,"game_type":"REG","home_team_id":"PHI","away_team_id":"LA","kickoff_utc":"2026-10-04T17:00:00Z","roof":"outdoors","neutral":false},{"game_id":"2026_04_NE_BUF","season":2026,"week":4,"game_type":"REG","home_team_id":"BUF","away_team_id":"NE","kickoff_utc":"2026-10-04T17:00:00Z","roof":"outdoors","neutral":false},{"game_id":"2026_04_NYJ_CHI","season":2026,"week":4,"game_type":"REG","home_team_id":"CHI","away_team_id":"NYJ","kickoff_utc":"2026-10-04T17:00:00Z","roof":"outdoors","neutral":false},{"game_id":"2026_04_TEN_BAL","season":2026,"week":4,"game_type":"REG","home_team_id":"BAL","away_team_id":"TEN","kickoff_utc":"2026-10-04T17:00:00Z","roof":"outdoors","neutral":false},{"game_id":"2026_04_MIA_MIN","season":2026,"week":4,"game_type":"REG","home_team_id":"MIN","away_team_id":"MIA","kickoff_utc":"2026-10-04T20:05:00Z","roof":"dome","neutral":false},{"game_id":"2026_04_DEN_SF","season":2026,"week":4,"game_type":"REG","home_team_id":"SF","away_team_id":"DEN","kickoff_utc":"2026-10-04T20:25:00Z","roof":"outdoors","neutral":false},{"game_id":"2026_04_KC_LV","season":2026,"week":4,"game_type":"REG","home_team_id":"LV","away_team_id":"KC","kickoff_utc":"2026-10-04T20:25:00Z","roof":"dome","neutral":false},{"game_id":"2026_04_LAC_SEA","season":2026,"week":4,"game_type":"REG","home_team_id":"SEA","away_team_id":"LAC","kickoff_utc":"2026-10-04T20:25:00Z","roof":"outdoors","neutral":false},{"game_id":"2026_04_DET_CAR","season":2026,"week":4,"game_type":"REG","home_team_id":"CAR","away_team_id":"DET","kickoff_utc":"2026-10-05T00:20:00Z","roof":"outdoors","neutral":false},{"game_id":"2026_04_ATL_NO","season":2026,"week":4,"game_type":"REG","home_team_id":"NO","away_team_id":"ATL","kickoff_utc":"2026-10-06T00:15:00Z","roof":"dome","neutral":false}]
