[{"game_id":"2024_15_LA_SF","season":2024,"week":15,"game_type":"REG","home_team_id":"SF","away_team_id":"LA","kickoff_utc":"2024-12-13T01:15:00Z","roof":"outdoors","neutral":false,"home_score":6,"away_score":12},{"game_id":"2024_15_BAL_NYG","season":2024,"week":15,"game_type":"REG","home_team_id":"NYG","away_team_id":"BAL","kickoff_utc":"2024-12-15T18:00:00Z","roof":"outdoors","neutral":false,"home_score":14,"away_score":35},{"game_id":"2024_15_BUF_DET","season":2024,"week":15,"game_type":"REG","home_team_id":"DET","away_team_id":"BUF","kickoff_utc":"2024-12-15T21:25:00Z","roof":"dome","neutral":false,"home_score":42,"away_score":48}]
